Id;Dificultad;Tema;Remitente;Descripcion;Malicioso
1;2;Bienvenido a CyberFort Labs: Entrenamiento en seguridad de correo electrónico;Remitente: CyberFort Labs training@cyberfortlabs.com;\n¡Felicidades por unirte al equipo de CyberFort Labs, [Nombre del jugador]!\n\nComo parte de tu entrenamiento, recibirás correos de práctica para ayudarte a mejorar tus habilidades de identificación de mensajes potencialmente peligrosos. En esta fase, tu tarea será detectar los correos fraudulentos entre los mensajes que hemos diseñado para ti.\n\nConsejos clave:\n\nSolicitud de datos: Desconfía de los correos que piden información personal de forma urgente o sin motivo claro.\n\nDiseño: Presta atención al diseño del mensaje, si parece descuidado o con errores, podría no ser seguro.\n\n¡Esperamos que completes este entrenamiento con éxito!\n\n;False
2;2;Bienvenido a CyberFort Labs - Guía para nuevos empleados;Remitente: CyberFort Labs HR hr@cyberfortlabs.com;\nEstimado [Nombre del jugador],\n\n¡Bienvenido a CyberFort Labs! En este correo encontrarás nuestra guía para nuevos empleados, que incluye detalles sobre la política de la empresa y recursos adicionales para ayudarte en tu primer día.\n\nPor favor, revisa y prepárate para nuestra sesión de introducción.\n\nSaludos,\n\nEl equipo de Recursos Humanos de CyberFort Labs.\n\n;False
3;2;Política de seguridad de información de CyberFort Labs;Remitente: IT Security security@cyberfortlabs.com;\nHola [Nombre del jugador],\n\nAdjunto encontrarás la política de seguridad de CyberFort Labs. Es fundamental que todos los empleados revisen este documento para entender cómo proteger la información de nuestra empresa.\n\nAsegúrate de leerlo y de completar la breve encuesta de confirmación al final del documento.\n\nGracias,\n\nEquipo de Seguridad de Información.\n\n; False
4;2; [URGENTE] Actualiza tus datos personales en el sistema;Remitente: CyberFort Labs hr@cyberfortlabs-email.com;\nEstimado [Nombre del jugador],\n\nEs urgente que actualices tus datos personales en nuestro sistema. Si no lo haces en las próximas 24 horas, tu cuenta será desactivada. Haz clic en el enlace para actualizar tu información.\n\nSaludos,\n\nEl equipo de Recursos Humanos de CyberFort Labs.\n\n;True
5;2;Recordatorio de sesión de ciberseguridad obligatoria;Remitente: CyberFort Training training@cyberfortlabs.com;\nHola [Nombre del jugador],\n\nEste es un recordatorio para la sesión de capacitación en ciberseguridad obligatoria. La sesión cubrirá temas importantes sobre la detección de correos maliciosos y la protección de datos.\n\nEsperamos tu participación. Si tienes alguna pregunta, no dudes en escribirnos.\n\nAtentamente,\n\nEl equipo de capacitación de CyberFort Labs.\n\n;False
6;2;Actualización de tu contraseña de acceso;Remitente: IT Support it@cyberfortlabs.com;\nHola [Nombre del jugador],\n\nComo parte de nuestras políticas de seguridad, te recomendamos que actualices tu contraseña de acceso cada tres meses. Para hacerlo, visita el portal de empleados y sigue las instrucciones.\n\nSi necesitas asistencia, nuestro equipo de soporte está disponible para ayudarte.\n\nSaludos,\n\nEl equipo de soporte de TI.\n\n;False
7;2;Necesitamos tu número de identificación ahora;Remitente: CyberFort Labs IT it-support@cyberforlabs.com;\nEstimado [Nombre del jugador],\n\nPara verificar tu cuenta, necesitamos que nos envíes tu número de identificación inmediatamente. Esto es esencial para mantener la seguridad de tu cuenta.\n\nPor favor, responde a este correo con la información solicitada.\n\nGracias,\n\nSoporte de TI de CyberFort Labs.\n\n;True