Id;Dificultad;Tema;Remitente;Descripcion;Malicioso
1;1;Bienvenido al nivel 1: Protección contra correos falsos;Remitente: Mail Guardian no-reply@mailguardian.com;"\nHola [Nombre del jugador],\n \nBienvenido al primer nivel de tu aventura en la identificación de correos electrónicos. Actualmente, te encuentras en casa, sin trabajo, y estás aplicando a diversas empresas. Aparte de respuestas laborales, también recibirás correos relacionados con tu vida personal: recibos de pago, suscripciones y notificaciones.\n\nRecuerda, aquí es fundamental que sepas detectar los correos sospechosos. Para esto:\n\n1. Dirección de correo: Asegúrate de que la dirección del remitente sea exactamente la de la empresa o entidad que representa.\n2. Autenticación: Verifica que el mensaje no muestre alertas de autenticación. Si el correo no pasa estas verificaciones, podría ser falso.\n\nBuena suerte, ¡y mantente alerta!";False
2;1;Actualización de la suscripción a StreamingPlay;Remitente: StreamingPlay Support support@streamingplay.com;\nEstimado [Nombre del jugador],\n\nQueremos informarte que tu suscripción a StreamingPlay se ha renovado correctamente. Si deseas actualizar tu plan o tienes alguna consulta, estamos aquí para ayudarte.\n\nGracias por ser parte de StreamingPlay.\n\nAtentamente,\n\nEl equipo de StreamingPlay.;False
3;1;Confirmación de recibo de pago de servicios públicos;Remitente: UtiliCo contacto@utilico.com;\nHola [Nombre del jugador],\n\nGracias por tu pago reciente del servicio de agua. Te confirmamos que tu cuenta ha sido actualizada y que el pago fue recibido exitosamente.\n\nCualquier pregunta o inquietud, no dudes en contactarnos.\n\nAtentamente,\n\nEl equipo de UtiliCo.;False
4;1; [URGENTE] Último paso para confirmar tu aplicación;Remitente: JobOffers support@j0b0fferz.com;\nHola [Nombre del jugador],\n\nEs urgente que confirmes tu aplicación de trabajo. Haz clic en el enlace para completar tu registro y asegurar tu lugar en nuestro proceso de selección.\n\nGracias,\n\nEl equipo de JobOffers.;True
5;1;Aceptación de solicitud de empleo en TechInnovate;Remitente: TechInnovate Careers careers@techinnovate.com;\nEstimado [Nombre del jugador],\n\n¡Gracias por tu interés en unirte a nuestro equipo en TechInnovate! Hemos recibido tu solicitud y comenzaremos a revisarla. Te contactaremos pronto con los próximos pasos en el proceso.\n\nSaludos cordiales,\n\nEl equipo de TechInnovate.\n\n;False
6;1;Recibo de pago mensual de suscripción de gimnasio;Remitente: GymMax Support supp0rt@gymnax.com;\nHola [Nombre del jugador],\n\nTe confirmamos que hemos recibido tu pago mensual. Tu membresía se encuentra activa y puedes continuar disfrutando de nuestros servicios.\n\nGracias por elegir GymMax,\n\nEl equipo de GymMax.\n\n;True
7;1;Verificación de información para la oferta de trabajo;Remitente: EmpOffers jobs@empoffers.co;\nEstimado [Nombre del jugador],Para finalizar tu proceso de aplicación, necesitamos que verifiques tu información. Haz clic en el enlace de abajo para completar esta verificación.\n\nGracias,\n\nEl equipo de EmpOffers.\n\n;False